name,rating,review,duration
David Austin, 5 stars ,"Pastor Wagenmaker is a gifted preacher, teacher and explains the subject matter fully and understandably. It's obvious he studies the subject and prepares his sermons over the week (not at the last minute).
The service as a whole is well rounded, has Christ as the focus, and communion is explained so all can understand. There is no muss or fuss, no choir or organ; however, there are people singing with the piano earnestly desiring to worship  Him simply in truth and spirit.
There is always something to snack on afterwards and a potluck once a month. Always a bunch extra for visitors :)
The people are friendly, genuinely care about everyone and their wellbeing. Just a great place to learn about God, our relationship with Him and to each other.",3 years ago
Steve White, 5 stars ,"The gospel is strongly proclaimed here each Sunday. The teaching and preaching are top notch. The body is loving and kind, and our family felt very welcomed here.",5 years ago
Eric Talbot, 5 stars ,Great Reformed teaching that is so rare in our day. I Highly recommend this Church.,4 years ago
Russel De Guzman, 5 stars ,Hear the Word of God preached here where Jesus Christ is the center of the Worship service.,6 years ago
Fred Smith, 5 stars ,Simply the best place of worship in the DFW area.,2 years ago
T M, 5 stars ,whooo doggie this church good,3 years ago
Clifton Wright, 3 stars ,"All good, but could be better .. 😋",3 years ago
A Dub, 5 stars ,Great Christ-centered preaching,2 years ago
Duce Barlow, 5 stars ,Great faithful presbyterian worship,5 years ago
